### ISSUE TITLE
feat(dot): PROXY protocol v2 to preserve client IP behind L4 front-end

### ISSUE THREAD

**Issue by bcookatpcsd** [razvandimescu/numa#143]
```
[doh]
	enabled = true
	port = 4433
	bind_addr = "10.20.0.15"
	# cert_path = "file.crt"
	# key_path = "file.key"
    cert_path = "/etc/lego/certificates/dns.domain.tld.crt"
    key_path = "/etc/lego/certificates/dns.domain.tld.key"
```

Looks like this does not exist.. 

but dot does?

**Comment by bcookatpcsd** [comment]
Will do dnsdist.. back end not seeing front end IPs is not a problem.. 

wish list.. 
 - proxy protocol?

**Comment by razvandimescu** [comment]
in the receipts you cand find the doh over lan configuration, there is little bit more work to do for the proxy to be elevated for public requests hence dnsdist shouldnbe the goto setup for now

**Comment by bcookatpcsd** [comment]
What is the port for the proxy protocol? 

re: multiple listen

one listen would provide [tcp|udp]:53 for regular dns and another port for proxy protocol 

https://unbound.docs.nlnetlabs.nl/en/latest/topics/core/proxy.html

does this mean the [server] bind_addr = "address:port" that :port is the proxy protocol port? 

Thank you in advance.

**Comment by bcookatpcsd** [comment]
numa version just gets the major version, not the version+commit as shown in webui

but this is: v0.14.3+e25bcb7

```

  ╔══════════════════════════════════════════╗
  ║ NUMA  DNS that governs itself  v0.14.3   ║
  ╠══════════════════════════════════════════╣
  ║  DNS       10.120.48.254:530             ║
  ║  API       http://localhost:5381         ║
  ║  Dashboard http://localhost:5381         ║
  ║  Upstream  127.0.0.1:5357                ║
  ║  Zones     0 records                     ║
  ║  Cache     max 100000 entries            ║
  ║  Blocking  disabled                      ║
  ╠──────────────────────────────────────────╣
  ║  Config    /var/lib/numa/numa.toml       ║
  ║  Data      /var/lib/numa                 ║
  ║  Services  /var/lib/numa/services.json   ║
  ╚══════════════════════════════════════════╝

[2026-04-30T13:32:48.221Z INFO  numa::serve] numa listening on 10.120.48.254:530, upstream 127.0.0.1:5357, 0 zone records, cache max 100000, API on port 5381
[2026-04-30T13:32:48.222Z INFO  numa::tcp] TCP DNS listening on 10.120.48.254:530
[2026-04-30T13:32:48.222Z INFO  numa::serve] HTTP API listening on 100.75.66.250:5381
[2026-04-30T13:33:17.275Z INFO  numa::ctx] 10.120.48.161:52361 | A www.google.com | UPSTREAM | NOERROR | 0ms
[2026-04-30T13:33:29.878Z INFO  numa::ctx] 10.120.48.161:55902 | A www.google.com | CACHED | NOERROR | 0ms
[2026-04-30T13:33:29.878Z WARN  numa::ctx] 10.120.48.161:44717 | RESOLVE ERROR | empty question section
[2026-04-30T13:34:09.141Z INFO  numa::ctx] 10.120.48.161:41167 | A www.google.com | CACHED | NOERROR | 0ms
```

and: 

```
kdig -p 530 @10.120.48.254 www.google.com +short
forcesafesearch.google.com.
216.239.38.120
```

numa.toml
```
# PROXY v2 also attaches to DoT — same semantics as [proxy.proxy_protocol].
[dot.proxy_protocol]
enabled = true
from = ["127.0.0.1/32"]
port = 538
bind_addr = "10.120.48.254"

```

(I understand the port is not listening and the acl says lo only.. ) 

```
❯❯ kdig -p 538 @10.120.48.254 www.google.com +short +tcp +proxy=10.120.48.161-10.120.48.254
;; WARNING: can't connect to 10.120.48.254@538(TCP)
;; ERROR: failed to query server 10.120.48.254@538(TCP)
```

tcp stream based or udp packet based

Thank you in advance

**Comment by razvandimescu** [comment]
For a working end-to-end reference, the dnsdist + numa + PROXY v2 harness lives at [`tests/docker/dnsdist-numa-l7/`](https://github.com/razvandimescu/numa/tree/main/tests/docker/dnsdist-numa-l7) Probably the fastest path to a green local setup.

Three answers:

1. **Direct answer:** `[server] bind_addr` is the DNS port. PROXY isn't a separate port in numa — it's a mode toggle on an existing listener via `[xxx.proxy_protocol].from`. When `from` is non-empty, that exact port becomes PROXY-required.

   | Listener | Block | Default port |
   |---|---|---|
   | Plain DNS-over-TCP | `[server.proxy_protocol]` | `:53` |
   | DoT | `[dot.proxy_protocol]` | `:853` |
   | DoH / .numa proxy | `[proxy.proxy_protocol]` | `:443` |

2. **Re: multiple listen.** Numa doesn't support Unbound's `proxy-protocol-port:` shape — you can't have `:53` direct + `:5353` PROXY-required on one numa. It's per-listener gating, one mode at a time. If you need both probably the best idea is to front *everything* with dnsdist (LAN included) so `:53` is uniformly PROXY-required.

3. **UDP caveat.** Today PROXY v2 is wired to TCP only (plain `:53`, DoT, DoH). UDP isn't covered yet (work in flight). Set `tcpOnly=true` on the dnsdist backend if you need real client IPs end-to-end now.

**Comment by bcookatpcsd** [comment]
definitely a good exercise here.. 

start the docker-compose stack after all is built: 
```
 docker-compose -f docker-compose.yml up
Attaching to dnsdist-1, numa-1
numa-1  | [2026-05-01T00:03:29.845Z INFO  numa::system_dns] detected system upstream: 127.0.0.11
numa-1  | [2026-05-01T00:03:29.845Z INFO  numa::system_dns] forwarding .188.onsite to 169.254.169.253
numa-1  | [2026-05-01T00:03:29.845Z INFO  numa::system_dns] detected 1 search domain forwarding rules
numa-1  | [2026-05-01T00:03:29.845Z INFO  numa::bootstrap_resolver] bootstrap resolver: 9.9.9.9, 1.1.1.1 via default (no IP-literal in upstream.fallback) — used for numa-originated HTTPS hostname resolution
numa-1  |
numa-1  |   ╔══════════════════════════════════════════╗
numa-1  |   ║ NUMA  DNS that governs itself  v0.14.3   ║
numa-1  |   ╠══════════════════════════════════════════╣
numa-1  |   ║  DNS       0.0.0.0:53                    ║
numa-1  |   ║  API       http://localhost:5380         ║
numa-1  |   ║  Dashboard http://localhost:5380         ║
numa-1  |   ║  Upstream  9.9.9.9:53                    ║
numa-1  |   ║  Zones     0 records                     ║
numa-1  |   ║  Cache     max 10000 entries             ║
numa-1  |   ║  Blocking  disabled                      ║
numa-1  |   ║  Routing   1 conditional rules           ║
numa-1  |   ╠──────────────────────────────────────────╣
numa-1  |   ║  Config    /etc/numa/numa.toml           ║
numa-1  |   ║  Data      /var/lib/numa                 ║
numa-1  |   ║  Services  /var/lib/numa/services.json   ║
numa-1  |   ╚══════════════════════════════════════════╝
numa-1  |
numa-1  | [2026-05-01T00:03:29.846Z INFO  numa::serve] numa listening on 0.0.0.0:53, upstream 9.9.9.9:53, 0 zone records, cache max 10000, API on port 5380
numa-1  | [2026-05-01T00:03:29.846Z INFO  numa::pp2] TCP: PROXY v2 enabled, trusting 1 CIDR(s)
numa-1  | [2026-05-01T00:03:29.846Z INFO  numa::tcp] TCP DNS listening on 0.0.0.0:53
numa-1  | [2026-05-01T00:03:29.846Z INFO  numa::serve] HTTP API listening on 0.0.0.0:5380
dnsdist-1  | dnsdist 2.0.0 comes with ABSOLUTELY NO WARRANTY. This is free software, and you are welcome to redistribute it according to the terms of the GPL version 2
dnsdist-1  | Added downstream server 172.29.0.10:53
dnsdist-1  | Raised send buffer to 4194304 for local address '0.0.0.0:53'
dnsdist-1  | Raised receive buffer to 4194304 for local address '0.0.0.0:53'
dnsdist-1  | Listening on 0.0.0.0:53
dnsdist-1  | ACL allowing queries from: 0.0.0.0/0, ::/0
dnsdist-1  | Console ACL allowing connections from: 127.0.0.0/8, ::1/128
dnsdist-1  | Warning, this configuration can use more than 10052 file descriptors, web server and console connections not included, and the current limit is 1024.
dnsdist-1  | You can increase this value by using ulimit.
numa-1     | [2026-05-01T00:03:30.152Z INFO  numa::ctx] 172.29.0.20:34822 | A a.root-servers.net | UPSTREAM | NOERROR | 18ms
dnsdist-1  | Marking downstream 172.29.0.10:53 as 'up'
dnsdist-1  | PowerDNS DNSDist Security Update Mandatory: Upgrade now, see https://dnsdist.org/security-advisories/powerdns-advisory-for-dnsdist-2025-05.html
numa-1     | [2026-05-01T00:03:44.802Z INFO  numa::ctx] 172.29.0.1:37406 | A numa.rs | UPSTREAM | NOERROR | 22ms
```
I added to dnsdist.conf to make the logs much less spammy
```
  healthCheckMode="lazy",
```

and do a dig for numa.rs: 
```
 kdig @127.0.0.1 -p 15454 +tcp numa.rs
;; ->>HEADER<<- opcode: QUERY; status: NOERROR; id: 6193
;; Flags: qr rd ra; QUERY: 1; ANSWER: 4; AUTHORITY: 0; ADDITIONAL: 1

;; EDNS PSEUDOSECTION:
;; Version: 0; flags: ; UDP size: 1232 B; ext-rcode: NOERROR

;; QUESTION SECTION:
;; numa.rs.            		IN	A

;; ANSWER SECTION:
numa.rs.            	300	IN	A	185.199.110.153
numa.rs.            	300	IN	A	185.199.108.153
numa.rs.            	300	IN	A	185.199.109.153
numa.rs.            	300	IN	A	185.199.111.153

;; Received 128 B
;; Time 2026-04-30 20:03:44 EDT
;; From 127.0.0.1@15454(TCP) in 24.3 ms
```

run tcpdump on a docker container with no tcpdump in it.. 
(this should see the proxy protocol) 

```
~/g/n/t/d/dnsdist-numa-l7 (main)> docker run --rm --net=container:dnsdist-l7-numa-1 nicolaka/netshoot tcpdump -i
 eth0 -A -nnvv port 53 -U -K
tcpdump: listening on eth0, link-type EN10MB (Ethernet), snapshot length 262144 bytes
00:03:44.779410 IP (tos 0x0, ttl 64, id 58612, offset 0, flags [DF], proto TCP (6), length 60)
    172.29.0.20.39044 > 172.29.0.10.53: Flags [S], seq 2067312710, win 64240, options [mss 1460,sackOK,TS val 3269706322 ecr 0,nop,wscale 10], length 0
E..<..@.@..n.......
...5{8.F........X..........
...R.......

00:03:44.779432 IP (tos 0x0, ttl 64, id 0, offset 0, flags [DF], proto TCP (6), length 60)
    172.29.0.10.53 > 172.29.0.20.39044: Flags [S.], seq 989198052, ack 2067312711, win 65160, options [mss 1460,sackOK,TS val 1119114684 ecr 3269706322,nop,wscale 10], length 0
E..<..@.@..c...
.....5..:...{8.G....X..........
B.U....R...

00:03:44.779450 IP (tos 0x0, ttl 64, id 58613, offset 0, flags [DF], proto TCP (6), length 52)
    172.29.0.20.39044 > 172.29.0.10.53: Flags [.], seq 1, ack 1, win 63, options [nop,nop,TS val 3269706322 ecr 1119114684], length 0
E..4..@.@..u.......
...5{8.G:......?X......
...RB.U.
00:03:44.779490 IP (tos 0x0, ttl 64, id 58614, offset 0, flags [DF], proto TCP (6), length 118)
    172.29.0.20.39044 > 172.29.0.10.53: Flags [P.], seq 1:67, ack 1, win 63, options [nop,nop,TS val 3269706322 ecr 1119114684], length 66 [prefix length(3338) != length(64)] (invalid)
E..v..@.@..2.......
...5{8.G:......?X......
...RB.U.

.
QUIT
!..............5.$... .........numa.rs.......)........
00:03:44.779496 IP (tos 0x0, ttl 64, id 24291, offset 0, flags [DF], proto TCP (6), length 52)
    172.29.0.10.53 > 172.29.0.20.39044: Flags [.], seq 1, ack 67, win 64, options [nop,nop,TS val 1119114684 ecr 3269706322], length 0
E..4^.@.@......
.....5..:...{8.....@X......
B.U....R
00:03:44.779729 IP (tos 0x0, ttl 64, id 37768, offset 0, flags [DF], proto UDP (17), length 64)
    172.29.0.10.48408 > 9.9.9.9.53: 0+ [1au] A? numa.rs. ar: . OPT UDPsize=1232 (36)
E..@..@.@......
				...5.,.v... .........numa.rs.......)........
00:03:44.802094 IP (tos 0x0, ttl 56, id 43516, offset 0, flags [none], proto UDP (17), length 128)
    9.9.9.9.53 > 172.29.0.10.48408: 0 q: A? numa.rs. 4/0/1 numa.rs. A 185.199.110.153, numa.rs. A 185.199.108.153, numa.rs. A 185.199.109.153, numa.rs. A 185.199.111.153 ar: . OPT UDPsize=512 (100)
E.......8..8				...
.5...l0..............numa.rs..............,....n..........,....l..........,....m..........,....o...)........
00:03:44.802374 IP (tos 0x0, ttl 64, id 24292, offset 0, flags [DF], proto TCP (6), length 182)
    172.29.0.10.53 > 172.29.0.20.39044: Flags [P.], seq 1:131, ack 67, win 64, options [nop,nop,TS val 1119114707 ecr 3269706322], length 130 0 q: A? numa.rs. 4/0/1 numa.rs. A 185.199.110.153, numa.rs. A 185.199.108.153, numa.rs. A 185.199.109.153, numa.rs. A 185.199.111.153 ar: . OPT UDPsize=1232 (128)
E...^.@.@......
.....5..:...{8.....@Y......
B.U....R...............numa.rs......numa.rs........,....n..numa.rs........,....l..numa.rs........,....m..numa.rs........,....o...)........
00:03:44.802421 IP (tos 0x0, ttl 64, id 58615, offset 0, flags [DF], proto TCP (6), length 52)
    172.29.0.20.39044 > 172.29.0.10.53: Flags [.], seq 67, ack 131, win 63, options [nop,nop,TS val 3269706345 ecr 1119114707], length 0
E..4..@.@..s.......
...5{8..:..g...?X......
...iB.U.
00:03:44.803368 IP (tos 0x0, ttl 64, id
``` 

this is a capture on a different host(s)
```
# tcpdump -i tailscale0 -nnvv -K port 538 -U -A
tcpdump: listening on tailscale0, link-type RAW (Raw IP), snapshot length 262144 bytes
20:14:04.207705 IP (tos 0x0, ttl 64, id 32532, offset 0, flags [DF], proto UDP (17), length 208)
    100.75.66.38.38099 > 100.103.162.90.538: UDP, length 180
E.....@.@...dKB&dg.Z........

.
QUIT
!!.$&.p......gD..A.. .....-.T.....d.....'............lh3.googleusercontent.com.......).......J...F......................................................................
20:14:04.207960 IP (tos 0x0, ttl 64, id 14532, offset 0, flags [DF], proto UDP (17), length 139)
    100.103.162.90.538 > 100.75.66.38.38099: UDP, length 111
E...8.@.@.Tkdg.ZdKB&.....w..'............lh3.googleusercontent.com..................googlehosted.l...7..........&...@.............)........
20:14:04.285783 IP (tos 0x0, ttl 64, id 25454, offset 0, flags [DF], proto UDP (17), length 388)
    100.75.66.38.32887 > 100.103.162.90.538: UDP, length 360
E...cn@.@.(.dKB&dg.Z.w...p..

.
QUIT
!!.$&.p........ZE..L .....-.T.....d.....(...........
soundcloud.com..A....).......U...Q.................................................................................

.
QUIT
!!.$&.p........ZE..L .....-.T.....d.....*...........
soundcloud.com.......).......U...Q.................................................................................
20:14:04.286370 IP (tos 0x0, ttl 64, id 14591, offset 0, flags [DF], proto UDP (17), length 135)
    100.103.162.90.538 > 100.75.66.38.32887: UDP, length 107
E...8.@.@.T4dg.ZdKB&...w.s..*...........
soundcloud.com.................4T.4............4T.#............4T.'............4T.9..)........
20:14:04.301930 IP (tos 0x0, ttl 64, id 14594, offset 0, flags [DF], proto UDP (17), length 152)
    100.103.162.90.538 > 100.75.66.38.32887: UDP, length 124
E...9.@.@.T dg.ZdKB&...w....(...........
soundcloud.com..A.............E.ns-799	awsdns-35.net..awsdns-hostmaster.amazon......... ......u...Q...)........
20:14:04.386443 IP (tos 0x0, ttl 64, id 32534, offset 0, flags [DF], proto UDP (17), length 208)
    100.75.66.38.38099 > 100.103.162.90.538: UDP, length 180
E.....@.@...dKB&dg.Z......q.

.
QUIT
!!.$&.p.....?/]W..T. .....-.T.....d.....+............ep1.adtrafficquality.google..A....).......H...D....................................................................
20:14:04.386494 IP (tos 0x0, ttl 64, id 25456, offset 0, flags [DF], proto UDP (17), length 208)
    100.75.66.38.32887 > 100.103.162.90.538: UDP, length 180
E...cp@.@.)zdKB&dg.Z.w.....D

.
QUIT
!!.$&.p.....?/]W..T. .....-.T.....d.....,............ep1.adtrafficquality.google.......).......H...D....................................................................
20:14:04.386592 IP (tos 0x0, ttl 64, id 32535, offset 0, flags [DF], proto UDP (17), length 208)
    100.75.66.38.38099 > 100.103.162.90.538: UDP, length 180
E.....@.@...dKB&dg.Z........

.
QUIT
!!.$&.p.....?/]W..T. .....-.T.....d.....-............ep1.adtrafficquality.google.......).......H...D....................................................................
20:14:04.386872 IP (tos 0x0, ttl 64, id 14620, offset 0, flags [DF], proto UDP (17), length 296)
    100.103.162.90.538 > 100.75.66.38.38099: UDP, length 268
E..(9.@.@.Svdg.ZdKB&.......X+............ep1.adtrafficquality.google..A...!.........1.lancache-tchntm.	hostadmin.9......8@.....	:.......)..............source=block-list-zone; blockListUrl=https://gitlab.com/hagezi/mirror/-/raw/main/dns-blocklists/adblock/light.txt; domain=adtrafficquality.google
20:14:04.386892 IP (tos 0x0, ttl 64, id 14621, offset 0, flags [DF], proto UDP (17), length 296)
    100.103.162.90.538 > 100.75.66.38.32887: UDP, length 268
E..(9.@.@.Sudg.ZdKB&...w...X,............ep1.adtrafficquality.google......!.........1.lancache-tchntm.	hostadmin.9......8@.....	:.......)..............source=block-list-zone; blockListUrl=https://gitlab.com/hagezi/mirror/-/raw/main/dns-blocklists/adblock/light.txt; domain=adtrafficquality.google
20:14:04.387008 IP (tos 0x0, ttl 64, id 14622, offset 0, flags [DF], proto UDP (17), length 296)
    100.103.162.90.538 > 100.75.66.38.38099: UDP, length 268
E..(9.@.@.Stdg.ZdKB&.......X-............ep1.adtrafficquality.google......!.........1.lancache-tchntm.	hostadmin.9......8@.....	:.......)..............source=block-list-zone; blockListUrl=https://gitlab.com/hagezi/mirror/-/raw/main/dns-blocklists/adblock/light.txt; domain=adtrafficquality.google
20:14:04.461300 IP (tos 0x0, ttl 64, id 25457, offset 0, flags [DF], proto UDP (17), length 208)
    100.75.66.38.32887 > 100.103.162.90.538: UDP, length 180
E...cq@.@.)ydKB&dg.Z.w.....~

.
QUIT
!!.$&.p........ZE..L .....-.T.....d..................optimizationguide-pa
googleapis.com..A....).......@...<............................................................
20:14:04.463603 IP (tos 0x0, ttl 64, id 14628, offset 0, flags [DF], proto UDP (17), length 149)
    100.103.162.90.538 > 100.75.66.38.32887: UDP, length 121
E...9$@.@.T.dg.ZdKB&...w.................optimizationguide-pa
googleapis.com..A...!.........-.ns1.google.,	dns-admin.E6..................<..)........
20:14:04.467329 IP (tos 0x0, ttl 64, id 32536, offset 0, flags [DF], proto UDP (17), length 208)
    100.75.66.38.38099 > 100.103.162.90.538: UDP, length 180
E.....@.@...dKB&dg.Z......'#

.
QUIT
!!.$&.p........ZE..L .....-.T.....d...../............optimizationguide-pa
googleapis.com.......).......@...<............................................................
20:14:04.467884 IP (tos 0x0, ttl 64, id 14632, offset 0, flags [DF], proto UDP (17), length 156)
    100.103.162.90.538 > 100.75.66.38.38099: UDP, length 128
E...9(@.@.S.dg.ZdKB&......../............optimizationguide-pa
googleapis.com..............L...."..........L.... ..........L....&..........L....$...)........
20:14:04.772113 IP (tos 0x0, ttl 64, id 25458, offset 0, flags [DF], proto UDP (17), length 208)
    100.75.66.38.32887 > 100.103.162.90.538: UDP, length 180
E...cr@.@.)xdKB&dg.Z.w....
.

.
QUIT
!!.$&.p..@)D.j3]!... .....-.T.....d..<..0............securitydomain-pa
googleapis.com..A....).......C...?...............................................................
20:14:04.772189 IP (tos 0x0, ttl 64, id 32537, offset 0, flags [DF], proto UDP (17), length 208)
    100.75.66.38.38099 > 100.103.162.90.538: UDP, length 180
E.....@.@...dKB&dg.Z.......Y

.
QUIT
!!.$&.p..@)D.j3]!... .....-.T.....d..<..1............securitydomain-pa
googleapis.com.......).......C...?...............................................................
20:14:04.772205 IP (tos 0x0, ttl 64, id 25459, offset 0, flags [DF], proto UDP (17), length 208)
    100.75.66.38.32887 > 100.103.162.90.538: UDP, length 180
E...cs@.@.)wdKB&dg.Z.w......

.
QUIT
!!.$&.p..@)D.j3]!... .....-.T.....d..<..2............securitydomain-pa
googleapis.com.......).......C...?...............................................................
20:14:04.772226 IP (tos 0x0, ttl 64, id 32538, offset 0, flags [DF], proto UDP (17), length 208)
    100.75.66.38.38099 > 100.103.162.90.538: UDP, length 180
E.....@.@...dKB&dg.Z........

.
QUIT
!!.$&.p..@)D.j3]!... .....-.T.....d..<..3............clients2.google.com..A....).......P...L............................................................................
20:14:04.772693 IP (tos 0x0, ttl 64, id 14889, offset 0, flags [DF], proto UDP (17), length 201)
    100.103.162.90.538 > 100.75.66.38.38099: UDP, length 173
E...:)@.@.R.dg.ZdKB&........1............securitydomain-pa
googleapis.com..............7..&...@.........._.........7..&...@.........._.........7..&...@.........._.........7..&...@.........._..)........
20:14:04.772767 IP (tos 0x0, ttl 64, id 25460, offset 0, flags [DF], proto UDP (17), length 208)
    100.75.66.38.32887 > 100.103.162.90.538: UDP, length 180
E...ct@.@.)vdKB&dg.Z.w....Ae

.
QUIT
!!.$&.p..@)D.j3]!... .....-.T.....d..<..4............memex-pa
googleapis.com.......).......L...H........................................................................
20:14:04.772791 IP (tos 0x0, ttl 64, id 32539, offset 0, flags [DF], proto UDP (17), length 208)
    100.75.66.38.38099 > 100.103.162.90.538: UDP, length 180
E.....@.@...dKB&dg.Z.......	

.
QUIT
!!.$&.p..@)D.j3]!... .....-.T.....d..<..5............memex-pa
googleapis.com.......).......L...H........................................................................
20:14:04.772824 IP (tos 0x0, ttl 64, id 25461, offset 0, flags [DF], proto UDP (17), length 208)
    100.75.66.38.32887 > 100.103.162.90.538: UDP, length 180
E...cu@.@.)udKB&dg.Z.w.....d

.
QUIT
!!.$&.p..@)D.j3]!... .....-.T.....d..<..6............memex-pa
googleapis.com..A....).......L...H........................................................................
20:14:04.772836 IP (tos 0x0, ttl 64, id 32540, offset 0, flags [DF], proto UDP (17), length 208)
    100.75.66.38.38099 > 100.103.162.90.538: UDP, length 180
E.....@.@...dKB&dg.Z......3z

.
QUIT
!!.$&.p..@)D.j3]!... .....-.T.....d..<..7............update
googleapis.com.......).......N...J..........................................................................
20:14:04.772859 IP (tos 0x0, ttl 64, id 25462, offset 0, flags [DF], proto UDP (17), length 208)
    100.75.66.38.32887 > 100.103.162.90.538: UDP, length 180
E...cv@.@.)tdKB&dg.Z.w....!.

.
QUIT
!!.$&.p..@)D.j3]!... .....-.T.....d..<..8............update
googleapis.com..A....).......N...J..........................................................................
20:14:04.772881 IP (tos 0x0, ttl 64, id 32541, offset 0, flags [DF], proto UDP (17), length 208)
    100.75.66.38.38099 > 100.103.162.90.538: UDP, length 180
E.....@.@...dKB&dg.Z......Lz

.
QUIT
!!.$&.p..@)D.j3]!... .....-.T.....d..<..9............update
googleapis.com.......).......N...J..........................................................................
20:14:04.772909 IP (tos 0x0, ttl 64, id 14890, offset 0, flags [DF], proto UDP (17), length 281)
    100.103.162.90.538 > 100.75.66.38.32887: UDP, length 253
E...:*@.@.Rwdg.ZdKB&...w...I2............securitydomain-pa
googleapis.com..............7....s_.........7....._.........7....._.........7....._.........7....._.........7....?_.........7....z_.........7..@.._.........7....._.........7....._.........7....._.........7....>_..)........
20:14:04.773427 IP (tos 0x0, ttl 64, id 14891, offset 0, flags [DF], proto UDP (17), length 150)
    100.103.162.90.538 > 100.75.66.38.38099: UDP, length 122
E...:+@.@.R.dg.ZdKB&........3............clients2.google.com..A...........>...clients.l...9.......U.&.ns1..	dns-admin..6..................<..)........
20:14:04.773524 IP (tos 0x0, ttl 64, id 14892, offset 0, flags [DF], proto UDP (17), length 256)
    100.103.162.90.538 > 100.75.66.38.32887: UDP, length 228
E...:,@.@.R.dg.ZdKB&...w...04............memex-pa
googleapis.com...................._..............o_..............._..............s_..............z_..............?_..............._..............._..............._..............._............@.._..)........
20:14:04.773618 IP (tos 0x0, ttl 64, id 14893, offset 0, flags [DF], proto UDP (17), length 190)
    100.103.162.90.538 > 100.75.66.38.38099: UDP, length 162
E...:-@.@.R.dg.ZdKB&........7............update
googleapis.com..............t..&...@..........q.........t..&...@..........e.........t..&...@..........d.........t..&...@.............)........
20:14:04.773776 IP (tos 0x0, ttl 64, id 14894, offset 0, flags [DF], proto UDP (17), length 174)
    100.103.162.90.538 > 100.75.66.38.38099: UDP, length 146
E...:.@.@.R.dg.ZdKB&........9............update
googleapis.com....................e...............q...............f...............................d..................)........
20:14:04.773911 IP (tos 0x0, ttl 64, id 14895, offset 0, flags [DF], proto UDP (17), length 192)
    100.103.162.90.538 > 100.75.66.38.38099: UDP, length 164
E...:/@.@.R.dg.ZdKB&........5............memex-pa
googleapis.com.................&...@.........._............&...@..#......._............&...@.........._............&...@.........._..)........
^C
32 packets captured
35 packets received by filter
0 packets dropped by kernel
```

I hope this helps. 

Thank you for your time and patience.
